[
  {
    "id": "ccs-2026",
    "title": "ACM CCS 2026 - ACM Conference on Computer and Communications Security",
    "venue_type": "conference",
    "rank": "A*",
    "area": [
      "SEC",
      "MPC"
    ],
    "topics": [
      "cryptography",
      "secure computation",
      "privacy",
      "applied cryptography"
    ],
    "deadline": "2026-04-29",
    "status": "closed",
    "official_url": "https://www.sigsac.org/ccs/CCS2026/",
    "source_url": "https://www.sigsac.org/ccs/CCS2026/",
    "last_checked": "2026-04-12",
    "notes": "Premier security conference with strong cryptography track; two-cycle review with second-cycle deadline on 2026-04-29",
    "location": "The Hague, Netherlands",
    "acceptance_rate": 15
  },
  {
    "id": "crypto-2026",
    "title": "CRYPTO 2026 - International Cryptology Conference",
    "venue_type": "conference",
    "rank": "A*",
    "area": [
      "MPC",
      "SEC"
    ],
    "topics": [
      "multi-party computation",
      "zero-knowledge proofs",
      "homomorphic encryption",
      "cryptographic protocols"
    ],
    "deadline": "2026-02-15",
    "status": "closed",
    "official_url": "https://crypto.iacr.org/2026/",
    "source_url": "https://crypto.iacr.org/2026/",
    "last_checked": "2026-03-29",
    "notes": "Leading venue for theoretical cryptography and MPC research",
    "location": "Santa Barbara, CA, USA",
    "acceptance_rate": 15
  },
  {
    "id": "eurocrypt-2026",
    "title": "EUROCRYPT 2026 - International Conference on the Theory and Applications of Cryptographic Techniques",
    "venue_type": "conference",
    "rank": "A*",
    "area": [
      "MPC",
      "SEC"
    ],
    "topics": [
      "secure computation",
      "cryptographic protocols",
      "privacy-preserving computation"
    ],
    "deadline": "2026-10-15",
    "status": "closed",
    "official_url": "https://eurocrypt.iacr.org/2026/",
    "source_url": "https://eurocrypt.iacr.org/2026/",
    "last_checked": "2026-03-29",
    "notes": "Top European cryptography conference",
    "location": "Vienna, Austria",
    "acceptance_rate": 15
  },
  {
    "id": "sp-2026",
    "title": "IEEE S&P 2026 - IEEE Symposium on Security and Privacy",
    "venue_type": "conference",
    "rank": "A*",
    "area": [
      "SEC",
      "MPC"
    ],
    "topics": [
      "privacy",
      "security",
      "secure protocols",
      "cryptography"
    ],
    "deadline": "2026-06-01",
    "status": "closed",
    "official_url": "https://www.ieee-security.org/TC/SP2026/",
    "source_url": "https://www.ieee-security.org/TC/SP2026/",
    "last_checked": "2026-03-29",
    "notes": "Oakland conference - top venue for security and privacy",
    "location": "San Francisco, CA, USA",
    "acceptance_rate": 15
  },
  {
    "id": "tcc-2026",
    "title": "TCC 2026 - Theory of Cryptography Conference",
    "venue_type": "conference",
    "rank": "A*",
    "area": [
      "MPC",
      "SEC"
    ],
    "topics": [
      "multi-party computation",
      "theoretical cryptography",
      "secure computation foundations"
    ],
    "deadline": "2026-12-31",
    "status": "upcoming",
    "official_url": "https://www.iacr.org/meetings/tcc/",
    "source_url": "https://www.iacr.org/meetings/tcc/",
    "last_checked": "2026-04-12",
    "notes": "Details for TCC 2026 are not yet published by IACR; deadline and location are placeholders until the official CFP is released",
    "location": "To be announced",
    "acceptance_rate": 15
  },
  {
    "id": "joc-si-mpc-2026",
    "title": "Journal of Cryptology - Special Issue on Advances in MPC",
    "venue_type": "journal",
    "rank": "Q1",
    "area": [
      "MPC"
    ],
    "topics": [
      "multi-party computation",
      "secure computation",
      "threshold cryptography"
    ],
    "deadline": "2026-07-31",
    "status": "closed",
    "official_url": "https://www.springer.com/journal/145",
    "source_url": "https://www.springer.com/journal/145",
    "last_checked": "2026-03-28",
    "notes": "Top cryptography journal with special focus on MPC",
    "location": "Online",
    "acceptance_rate": 25
  },
  {
    "id": "tdsc-2026",
    "title": "IEEE TDSC - Transactions on Dependable and Secure Computing",
    "venue_type": "journal",
    "rank": "Q1",
    "area": [
      "SEC",
      "MPC"
    ],
    "topics": [
      "secure computation",
      "privacy",
      "cryptographic protocols",
      "security"
    ],
    "deadline": "2026-12-31",
    "status": "open",
    "official_url": "https://www.computer.org/csdl/journal/tq",
    "source_url": "https://www.computer.org/csdl/journal/tq",
    "last_checked": "2026-03-28",
    "notes": "Rolling submissions accepted throughout the year",
    "location": "Online",
    "acceptance_rate": 25
  },
  {
    "id": "fc-2026",
    "title": "FC 2026 - Financial Cryptography and Data Security",
    "venue_type": "conference",
    "rank": "A",
    "area": [
      "SEC",
      "MPC"
    ],
    "topics": [
      "applied cryptography",
      "blockchain security",
      "privacy-preserving computation"
    ],
    "deadline": "2026-09-15",
    "status": "closed",
    "official_url": "https://fc26.ifca.ai/",
    "source_url": "https://fc26.ifca.ai/",
    "last_checked": "2026-03-29",
    "notes": "Strong focus on applied cryptography and MPC applications",
    "location": "Curaçao",
    "acceptance_rate": 22
  },
  {
    "id": "dsrt-2026",
    "title": "DS-RT 2026 - IEEE/ACM International Symposium on Distributed Simulation and Real Time Applications",
    "venue_type": "conference",
    "rank": "B",
    "area": [
      "SEC"
    ],
    "topics": [
      "distributed systems",
      "security",
      "real-time systems"
    ],
    "deadline": "2026-07-15",
    "status": "closed",
    "official_url": "https://ds-rt.com/2026/",
    "source_url": "https://ds-rt.com/2026/",
    "last_checked": "2026-03-29",
    "notes": "Focus on distributed simulation and real-time applications with security aspects",
    "location": "London, UK",
    "acceptance_rate": 28
  },
  {
    "id": "mobicom-2026",
    "title": "MobiCom 2026 - ACM International Conference on Mobile Computing and Networking",
    "venue_type": "conference",
    "rank": "A*",
    "area": [
      "SEC"
    ],
    "topics": [
      "mobile security",
      "network security",
      "privacy",
      "wireless security"
    ],
    "deadline": "2026-08-15",
    "status": "closed",
    "official_url": "https://www.sigmobile.org/mobicom/2026/",
    "source_url": "https://www.sigmobile.org/mobicom/2026/",
    "last_checked": "2026-03-29",
    "notes": "Premier mobile computing and networking conference with strong security track",
    "location": "Sydney, Australia",
    "acceptance_rate": 15
  },
  {
    "id": "infocom-2027",
    "title": "IEEE INFOCOM 2027 - IEEE International Conference on Computer Communications",
    "venue_type": "conference",
    "rank": "A*",
    "area": [
      "SEC"
    ],
    "topics": [
      "network security",
      "communication networks",
      "internet architectures",
      "wireless networks"
    ],
    "deadline": "2026-07-25",
    "status": "closed",
    "official_url": "https://ieee-infocom.org/",
    "source_url": "https://ieee-infocom.org/",
    "last_checked": "2026-04-12",
    "notes": "Expected dates May 17-20, 2027 in Honolulu, Hawaii; CORE A* venue; abstract deadline July 17 with full paper due July 25, 2026 at 14:59:59; CFP yet to be announced",
    "location": "Honolulu, Hawaii, USA",
    "acceptance_rate": null
  },
  {
    "id": "secrypt-2026",
    "title": "SECRYPT 2026 - International Conference on Security and Cryptography",
    "venue_type": "conference",
    "rank": "B",
    "area": [
      "SEC",
      "MPC"
    ],
    "topics": [
      "cryptography",
      "security",
      "network security",
      "applied cryptography"
    ],
    "deadline": "2026-04-20",
    "status": "closed",
    "official_url": "https://secrypt.scitevents.org/",
    "source_url": "https://secrypt.scitevents.org/",
    "last_checked": "2026-03-29",
    "notes": "International conference focusing on security and cryptography research",
    "location": "Porto, Portugal",
    "acceptance_rate": 28
  },
  {
    "id": "ches-2026",
    "title": "CHES 2026 - Cryptographic Hardware and Embedded Systems",
    "venue_type": "conference",
    "rank": "A*",
    "area": [
      "SEC",
      "MPC"
    ],
    "topics": [
      "hardware security",
      "cryptographic implementations",
      "side-channel attacks",
      "secure computation"
    ],
    "deadline": "2026-07-15",
    "status": "closed",
    "official_url": "https://ches.iacr.org/2026/",
    "source_url": "https://ches.iacr.org/2026/",
    "last_checked": "2026-03-29",
    "notes": "Premier venue for cryptographic hardware and embedded systems security",
    "location": "Taipei, Taiwan",
    "acceptance_rate": 15
  },
  {
    "id": "ndss-2027",
    "title": "NDSS 2027 - Network and Distributed System Security Symposium",
    "venue_type": "conference",
    "rank": "A*",
    "area": [
      "SEC"
    ],
    "topics": [
      "network security",
      "cryptography",
      "privacy",
      "applied security"
    ],
    "deadline": "2026-06-15",
    "status": "closed",
    "official_url": "https://www.ndss-symposium.org/ndss2027/",
    "source_url": "https://www.ndss-symposium.org/ndss2027/",
    "last_checked": "2026-03-29",
    "notes": "Top-tier network and distributed system security conference",
    "location": "San Diego, CA, USA",
    "acceptance_rate": 15
  },
  {
    "id": "usenix-security-2026",
    "title": "USENIX Security 2026 - USENIX Security Symposium",
    "venue_type": "conference",
    "rank": "A*",
    "area": [
      "SEC",
      "MPC"
    ],
    "topics": [
      "security",
      "privacy",
      "cryptography",
      "applied security"
    ],
    "deadline": "2026-05-20",
    "status": "closed",
    "official_url": "https://www.usenix.org/conference/usenixsecurity26",